{"accessOwner":"release-security","artifacts":[{"artifactId":"9631253528","payload":{"bucket":"Tenant_Bucket[Prod] raw","key":"raw % # ? [x] café 😀/path=/var/tmp/9631253528.zip","locator":"s3://Tenant_Bucket[Prod] raw/raw % # ? [x] café 😀/path=/var/tmp/9631253528.zip","provider":"S3_COMPATIBLE","sha256":"1f087ef27cfabbb2152d06fc002eb0772c2efbbb63964d6b13ec5f0d7a73ed7a","sizeBytes":55065,"versionId":"latest"},"receiptReference":{"bucket":"Tenant_Bucket[Prod] raw","key":"receipt % # ? [x] café 😀/path=/var/tmp/9631253528.json","locator":"s3://Tenant_Bucket[Prod] raw/receipt % # ? [x] café 😀/path=/var/tmp/9631253528.json","provider":"S3_COMPATIBLE","sha256":"dddddddddddddddddddddddddddddddddddddddddddddddddddddddddddddddd","sizeBytes":512,"versionId":"latest"},"sourceCommit":"892fb23ce75e7f74a05c1b5e304fccace70ee8d3","sourceRunId":"33033752846"},{"artifactId":"9631250285","payload":{"bucket":"Tenant_Bucket[Prod] raw","key":"raw % # ? [x] café 😀/path=/var/tmp/9631250285.zip","locator":"s3://Tenant_Bucket[Prod] raw/raw % # ? [x] café 😀/path=/var/tmp/9631250285.zip","provider":"S3_COMPATIBLE","sha256":"e7602924fe67fd6eff75ebfe5d48122240639d883edc58dc164c419893d979ca","sizeBytes":55099,"versionId":"latest"},"receiptReference":{"bucket":"Tenant_Bucket[Prod] raw","key":"receipt % # ? [x] café 😀/path=/var/tmp/9631250285.json","locator":"s3://Tenant_Bucket[Prod] raw/receipt % # ? [x] café 😀/path=/var/tmp/9631250285.json","provider":"S3_COMPATIBLE","sha256":"dddddddddddddddddddddddddddddddddddddddddddddddddddddddddddddddd","sizeBytes":512,"versionId":"latest"},"sourceCommit":"8687d49c9566030bb0829752dbe5dda45af02f4b","sourceRunId":"33033740162"}],"capabilityCheckedAt":"2026-08-27T01:00:00Z","completedAt":"2026-08-27T01:00:02Z","descriptorSha256":"c15e1245f172462db85cc70aef197b4109da3aa428c59992ba2de737e22e9b49","errorCode":null,"executionId":"aaaaaaaa-bbbb-4ccc-8ddd-eeeeeeeeeeee","immutabilityControl":"COMPLIANCE","pilotManifestSha256":"7bcb4d9df5ce0e28fe6150e0593c9824ea2533a2f7885f17d61d3ae813aa4a32","policyFingerprint":"ffffffffffffffffffffffffffffffffffffffffffffffffffffffffffffffff","retentionPolicy":"P730D","runtimeIdentity":{"principalFingerprint":"aaaaaaaaaaaaaaaaaaaaaaaaaaaaaaaaaaaaaaaaaaaaaaaaaaaaaaaaaaaaaaaa","provider":"S3_COMPATIBLE"},"schemaVersion":1,"startedAt":"2026-08-27T01:00:00Z","status":"PASS","workPackageId":"V0-2-EVIDENCE-ARCHIVE-001"}